{
  "contract_version": "1.0.0",
  "schema_id": "karrierekrake.reply_draft",
  "case_id": "case-demo-010",
  "action": "PROPOSE_SLOTS",
  "to_address": "hr10@example.com",
  "subject": "Betreff 10",
  "body": "Körpertext 10\n",
  "created_at": "2026-09-20T12:00:00Z",
  "approved": false,
  "binding_review_approved": false,
  "sent": false,
  "draft_only": true,
  "auto_send": false,
  "requires_explicit_review": true,
  "blocking_reasons": []
}
